clip_id,text,word_count,language,is_empty,is_very_short
clip_0906,them and looking behind. Clear behind. Keep your pace up into turn one. Certain new position. Great mode where you can as well on this lap. You're going to come out in front of stroll. That's good.,37,en,False,False
clip_0907,the car in front of Limblads an eight second gap. That's good there. So Steintz nine seconds ahead. All these cars pushing next time. So we're going to go standard lap from nine. Hold this position. Okay so from nine we're going to go standard.,45,en,False,False
clip_0908,little laps so weaving and no straight. Car in front nine seconds is bare men. Let's go weaving down to seven. Hold this position and then go out 1.5 behind. No one pushing everyone out laps. Okay so watch track exit 13.,42,en,False,False
clip_0909,Sermon in front will push next time. And good strong weaving down the straight please. All the way to Porto. Good strong weaving. In a good position you know. Four cars to go in front. Good braking to Porto. Three cars to go. No threats behind. Two cars to go.,50,en,False,False
clip_0910,"Then taking a gap. So part throttle, strap 2. Exactly as you've been doing. 20m lift into 11 this time and you're good to go. Last lap. Strap 1 and box, that's the checkered plug. Boxing now staying negative on the Delta please.",43,en,False,False
clip_0911,"So the moment that's P10, so it's on site. So everyone behind is taking flags of no risk of traffic, staying negative on the Delta. Quite a lot of cars use three sets there. So both William, Lothan, Sainz, Troll along to the All-Penetrate 3, Franco as well. Who is out?",51,en,False,False
clip_0912,"Car's out, Sainz, Albon, Alonso, Bottas, Stroll and Harris. P16 was lost. Okay, so it's negative on the Delta, Fox and Alton, but balance is not worrying. So focus on that first lap of the comment. Over, over the aircar!",40,en,False,False
clip_0913,fix lap in turn 1 on this last lap yeah copy that we think we can explain that with the tyres on the second lap so that fix itself for the next session yeah on my first push so I could much understand this gear turn 1 thanks,48,en,False,False
clip_0914,"Understood, I will think about flat then If you're around boxing now please, box to box, you want the way you want Just stop in front of the garage and we'll see you Alright, so we'll just get some parts when you're plugged in",44,en,False,False
clip_0915,"Okay, just watch for Hulkenberg 5 behind starting.",8,en,False,False
clip_0916,"Okay, so standard outlap, good weaving. Add weaving, we're going to go 200 through 7. Next car pushing is about 15 behind that toggle. So weaving down to 11. So let's push 13 exits and strong weaving down to 14.",40,en,False,False
clip_0917,"Ocon is 13 seconds behind on a push lap so looking good here. Strong weaving to 14, no cars waiting in front, no threats behind. That's good, so strat-term part-crockle, you're good to go. Let's go for that lift into 11 this time please, 20 meters.",46,en,False,False
clip_0918,"I lost it a damn! You need to try and hook up the last one, fuck sake! Okay mate, strat one. Strat one. Keep your pace up, mate. Uhhh... Lost the rear. Lost the rear at the end and...",39,en,False,False
clip_0919,"Drogma's looking good up to that point, still P8 with that one so... Yeah, that's not gonna be good enough. Not good enough. Yeah, alright. Well, we'll work on it, yeah. So, have a think about balance first off, but you can control. How was it? Do you need some more flap? Oh no. Oh, I lost the round there. Done.",61,en,False,False
clip_0920,with that more pushy outlap I think we'll be looking to do the same again ok so staying negative on the delta ok mate so the deployment strategy we've got that lap I think we can expect the same again nothing wrong with it doing what it's supposed to do alright,51,en,False,False
clip_0921,"the previous reference, but it seemed different. That lived into 11s, 50 meters, that was good. We want the same again please. Fox, Fox. So Fox now watch for the way bridge lights on the way. And way bridge, way bridge, way bridge, we're good for time. Okay mate, so coming up to the way bridge.",56,en,False,False
clip_0922,"bridge, comfort stop, go to P1, and the car is pushed clear, go to P2, and then an MGUK start holding.",21,en,False,False
clip_0923,"They pull enough in front of the garage. You've got Hamilton five behind. Hamilton time lap five. Great mode down to six, no weaving. Hamilton not pushing behind the car. Hamilton clear behind. Straight mode to six, no weaving. Steady on track. Portion on track.",45,en,False,False
clip_0924,"of 6, 200 through 7. So weaving down to 11, weaving down to 11. I'm unsure at this stage whether Piastri is going to cool and then push again. I think he'll box. Happy to go in front of him. Strong weaving down to 14. Next car pushing behind.",49,en,False,False
clip_0925,"Hulkenberg fixed second. Okay so key here is good drive through the last couple of corners, strong weaving down to 14. Clear tracking for us. So only car to watch, Hulkenberg 3.5, 3 second. 2.5. Heart throttle, strap 2, good to go.",42,en,False,False
clip_0926,"Off the Berg 1 and I'm on the behind land, a little behind him. And the real set, let's go. Track 1 and box you are safe for 3, welcome. Cheers, Esq. Lift off, you smell a lot of sweet energy in the lab.",44,en,False,False
clip_0927,"A lot going on, I got to do better and turn 11 with the list off. We were 4 pack 8th, 8th at 13th there, that actually was okay. Sorry you didn't see the double yellow flag that nearly got us at the end of the lap as well. Alright. Yeah, could be worse. Okay mate, so pace up please.",60,en,False,False
clip_0928,next on the Delta and again have a think about balance. I think that warm up for us was good on the out lap and we were going to target something. I issues done 14 again with that. My torque is very inconsistent. Turn 11 I had a lot of push on this lap.,54,en,False,False
clip_0929,"14 still the handbrake There is anything you can do to help me a lot Yeah we'll have a look at that one Stay negative on the Delta please Everyone's taking the flags behind Good jump, G3 again, so Yeah, 3 in P6 at the moment",46,en,False,False
clip_0930,"Okay mate, so only other point, we've got constant 15-8-6-3, as well there is performance there, so box now please. So we've got a couple of options as to what we do here for the next run. You can either do two runs, or just a single new run at the end.",52,en,False,False
clip_0931,"I'm still doing the use of the U-SARS. Yeah, that's good work for the way to do it again. Otherwise stop in front of the garage and we will. I need a bank here and the yellow truck or something. That's very easy. Just have a think about that. Yeah, I'm still going basically understeer late.",56,en,False,False
clip_0932,"Well, yep, that was really cold. That one unboxed. That one unboxed. And the new used is the wind decreasing. That was a fair amount of fun.",27,en,False,False
clip_0933,and stop in front of the garage. OK.,8,en,False,False
clip_0934,"I'm going to think about half a turn up from the air again for the... Okay, 3, 2, 1, let's go. So, gentle traction and straight mode to turn 6, please. Gentle traction out at 3 and straight mode to turn 6. SM to turn 6.",46,en,False,False
clip_0935,gentle traction exits. 200 through 7. 200 through 7. Strong weaving down to 11. Coming up nicely. Strong traction exit 13. Strong weaving to 14. You can make it clear in front.,32,en,False,False
clip_0936,"Our throttle, strat 2, and good to go. Remember lift into 11, 30 meters. Last lap, let's push. Strat 14, please. Strat 14, and stay just negative on the Delta. Keep the six at the moment, just rustle to set a time.",42,en,False,False
clip_0937,Holy Russell We've got the two Red Bulls finishing laps right now. I'll let you know where they are They just negative on the Delta please on the way around just Jar just behind us the staff and just behind us only Russell,43,en,False,False
clip_0938,"Tell about Russell, different race. Very good job. The P7, at the time they forced us, all of that, just made a cleaner race, so very good job. Did the lap. Yes, Mike, welcome. I'm well managed as well.",39,en,False,False
clip_0939,"Just saying just negative on the Delta please and the Russell P2 just Okay, well done so boxing now please into the parking lot. I got the smaller I spoke for this so yes",34,en,False,False
clip_0940,"So two and a half to Norris in front and another half to Tencent to the S3. Box box into power front. So, what was the time of the Red Bull? The staff in 33.0, he's in 38 and another 10th and a bit off for Hajar, 33.1.",48,en,False,False
clip_0941,"When he comes to stop P1 and MP0. Alright, good job. Let's make it work tomorrow.",16,en,False,False
clip_0942,Thanks for watching guys!,4,en,False,False
clip_0943,"Skip the blankets. Can you confirm cloud 7? Can I confirm asian cloud 7? Do you want me to do a lot of straights? 0 to 50% properly possible mate. So it's completely normal that you stay in the middle also if you go to the right. Ok mate, so here we are.",53,en,False,False
clip_0944,"We're doing four burnouts, climbing up from the side. Reminder, we've got an empty grid slot in front of us. Four burnouts, empty grid slot in front of us. You can reverse, but you can position good there. Okay guys, so the Strat 7, we're all set. Let's press the burn.",51,en,False,False
clip_0945,"out button now please. Not the blue lights. Pre-start red. Overtake enabled. Car behind Franco. Good job. Time out and it looks good. Great job so far. Car behind three seconds. Third product will not work this evening. OK, let's settle in for now. Good job. Some ports, hawk delivery.",50,en,False,False
clip_0946,I want the gap and any corner blue.,8,en,False,False
clip_0947,"Yeah, understood. Gap 3.7, oars looking good mate, just keep going. Increase management, turn 8. Increase management, turn 8. Watch up trips into 1, down trips into 1. Gap behind 4.1, no driven losses. End time management, that's it. Okay, another step increase of management, turn 8 please. Little bit more management.",52,en,False,False
clip_0948,"Gap behind 4.4, just need to keep watching that front, no more pushing than you did last lap and you did more management as well. 3-4-10 quicker than all cars behind. Gap behind 5 seconds, hour the tyres please, safety car window is open. Does the quads lift? I can make it, doing a great job here, just keep it up.",61,en,False,False
clip_0949,"pulling away. Standby. Everything good. Everything is good, everything good. We're on plan A at the moment. We've done gap 5.5. Who's the car behind? The car behind Franco 5.6. Two seconds behind him is Ocon also on the half. OK, mate, so safety.",44,en,False,False
clip_0950,"car and VSC windows open, safety car and VSC windows open, box, box, box, box. Right, we're going half a turn down onto the hard tyre. Happy with that? Box, box, pick confirm, please. Box, box, pick confirm. Box, box, pick confirm. Box, box, box, box. OK, mate. Hard tyre, half a turn down. Keep in line, we balance, mate.",60,en,False,False
clip_0951,"and we'll go draft one, draft one, stop onto hard tire, clear behind, clear behind. So we're following the Delta please, so just stay positive on that. Our Delta boost, no boost. All this time, detentures, BMS.",37,en,False,False
clip_0952,"Yeah, understood, you're all good mate, no rule for right. So what we're doing now mate, we're staying in Strap 1, we're going to charge the pack to back up and we're going to add warm up where possible. What are these blue lights? Blue lights on the ducts? I'm sure on that one, for now no action required, you're all good.",62,en,False,False
clip_0953,"OK mate, so there's just some safety car warning lights, nothing to worry about. Or a safety car is the car behind. OK mate, so where we are at the moment. We've got Fairman, who's just left the pit lane. He's 12 seconds behind. I thought these blue lights on my dash. They are just warnings for the safety car, I believe mate. No worry.",65,en,False,False
clip_0954,"There is no action required in the new vehicle. Okay mate, so where we are with cars. So Hülkenberg in front did not stop 10 left-hold cars. You've got Leclerc in front of him who did. And then Limblad didn't stop on 10 left-hold cars. So we're currently P9. Four cars in front did not stop. So we've got double yellow at turn two now.",65,en,False,False
clip_0955,"And we've got marshals on track there so Corvian Vernon, who's recovered in one track as well. So all we're doing at this point right is keeping warm in the tyres. The factory's all looking good. Car's behind Fairman on U-Hard, then Alonso on U-Hard.",45,en,False,False
clip_0956,"Everyone boxed behind Alonso and Perez, yeah. So cars in front still to pit are Franco, Ocon, Linblad and Hub. It's a double way of yellow where you are. So we are looking at plan A. How many loves to go?",41,en,False,False
clip_0957,"45, including this one. So we're going to keep monitoring mate, for now let's work to plan it. Anything I've got a 10th compared to the first 10th or half you would have. Your first 10th was spot on. Same again please. Absolutely spot on. And again you were 3-4 10ths quicker than all cars been.",56,en,False,False
clip_0958,"behind even the ones in clean air so even the ship didn't do the good thing. Ok so what's going to happen from now, safety car is still out staying out for at least another lap. We're going to stay in strat 1 until we get to 14 where we'll go to strat 10 once we get to restart.",59,en,False,False
clip_0959,"Now the stage you are keeping So in front of us is Lin Glad, Lawson is three cars bit That car turns two, it's near the track, no? So it looks like it will be one more lap Okay, so",40,en,False,False
clip_0960,"where we can this lap we want to avoid going above 50% throttle, where we can avoid 50% throttle and above. Remind you've got that red line on your dash to help guide you that. So the safety car is in this lap so let's maintain heart throttle until low. Where best? No, do I slip? Yes, one.",58,en,False,False
clip_0961,"Okay mate, so we are going to go strat 7 at turn 14. You can go strat 7 if cars go before. Reminder, less than 50% throttle. Batteries full. Charge level is high. Okay mate, charge level getting high. Keep up 50% throttle please. I'll pull it away. No be strat 7.",52,en,False,False
clip_0962,"14 and less cars pull away Stappen the car behind boost available if needed Fire a sighting for one Fire energy is good, the Stappen behind Can make good job on tyres Using boost down to turn one, press and hold the whole straight Stappen further back this time, good job Boost use is good",55,en,False,False
clip_0963,"Good job, Limp. Old parts in front. Staff are down. Offal to free right hand side on this straight. Ok mate, very good. Let's go to the airman. Overtake available. Increase management turn-off. What's the staff? First of all, little slack.",41,en,False,False
clip_0964,down on this straight this time good job keep it up yeah that wasn't fair one meal of the roof sorry that wasn't fair we've reported it let's focus you got this cars behind a Hulkberg and Limb Lab used parts a lot of torque under the,47,en,False,False
clip_0965,"reporting that time Okay, don't worry, we'll come back This is all the stuff over its face crazy Okay, so that happens because you lifted and then went back on power for turn 14 So we need to avoid that to stop spending it off",45,en,False,False
clip_0966,I think,2,en,False,True
clip_0967,"Gap behind stable one second. Reminders to keep one line under braking and being attacked. Gap 1.2 behind now. Tire management is all good. Only drift loss is 1.2. 30 laps to go. Gap behind stable 1.2. Only loss, drop on the front, turn 3. Focus, exit.",47,en,False,False
clip_0968,"Cap behind stable 1.3, time out of orbit. South-Frankfors. No, it's South-Frankfors. I want to go up to max 8-billar. Understood, 5 seconds. That's it. And I guess what he did is okay, right? Yeah. You see. Yeah. Well, it's like catching...",42,en,False,False
clip_0969,the,1,en,False,True
clip_0970,"I lost, right? Out of 10th gear. Understood, we're looking. One 10th, quicker sector one, two 10ths, quicker sector two, the max that time. Keep out. I can't hear you, can't hear you. Okay, may drive, we'll go, just head down and focus. Three 10ths quicker than the staff in sector two that time. Keep out. The oversteering 14 is all torque delivery. Half the...",65,en,False,False
clip_0971,"second quicker than the staff in the staff in the slump sector 2. Keep up. High management all good, 24 to go. In the staff in every sector another 4-10s up sector 2. Keep up. 1-1-1-1. Still 2-10s to lap quicker. Hülkenberg behind still needs to box. Everyone in front, we expect going to the end.",56,en,False,False
clip_0972,"Watch downkits into one, stay on line 4 to 6. Those downkits were spot on, same again. Gap in front, 4.7 now, we're railing them. Keep going. 21 laps to go. Gap 4.6 now, time management all good. Keep it up. 20 laps to go. Catching both cars.",48,en,False,False
clip_0973,in front three tenths every lap Peter I can't hear you on the bar street catching the cars in front three tenths every lap Peter still quicker than both cars in front well how do you think this tyre would be if there was a safety car not good enough problem ok mate still catching Peter,56,en,False,False
clip_0974,"and keep focused. So Lawton had your behinder within our safety carbonate window. Let's keep building the gap. 310s quicker than the cars in front, a second quicker than the cars behind. No driven losses to the cars in front. Main gain on for Staffordness turns 7 and 8. 15 laps to go.",53,en,False,False
clip_0975,still closing up that gap 2.5 now keep it up think about top right modify the turn nine think about top right turn nine another 1.2 seconds we'll be within the FIA overtake to the stop and keep it up keep going if there was a safety car up here we'd come out just in front of Lawson Hager we can very close to the trimpo,66,en,False,False
clip_0976,"OK. Top right looks good. 12 laps to go, gap 2 seconds. An important for Rastappen. Yeah, we think safety car window open for a soft tyre. 11 to go, what do you think? It's an 11 laps after this one. 11 laps after this one, yeah. Yes.",48,en,False,False
clip_0977,Copy. Wait some more.,4,en,False,False
clip_0978,"straight each lap, just keep it up. Uh, don't kiss you. Uh. Understood my ear trick, just gonna keep going with it. Keep going. Brake fires half a percent of rearwards, it will help turn 14. Batman's only gains on turn 1, he's turned 8-9, he's struggling with the fronts more than us. Harry's in front of him, he's gonna get a...",62,en,False,False
clip_0979,"I'm getting a lot of pc Understood, 8 to go Not lift Air is in front, has a blue flag for you 7 laps to go, no threats behind Yeah, fair, that's too long Okay mate, has that solid blue now 6 laps to go",45,en,False,False
clip_0980,"2.8 seconds, we're still catching them, let's go. Sherman gaining mid corner turn 3 and turn 8, we're happy to push the tyre if you can. I'm looking up. 5 left, go 2.7. Safety car windows are closed. Sherman struggling a little more, 7, 8, 9 that time, let's keep pushing.",51,en,False,False
clip_0981,"2.6 4 to go Just watch the front lockings this tyre gets older 2.4 3 laps to go I think to make one mistake, maybe a bit up 2 laps to go, 2.3 3.0 More lap after this, press and hold, boost into turn 1 this time",47,en,False,False
clip_0982,"Last lap, press and hold boost. Press and hold boost all the way to 14. Press and hold start, can you find it? I might as well check it. Strap 13, please. Strap 13. Pick up rubber. Oh man, I gave everything I had. I really wanted to get the P5 because...",52,en,False,False
clip_0983,"That's the third race was the 9th. Yeah, I tried everything to catch up, but I didn't do much. There was nothing more in it. Yes mate, we're disappointed with the 6th at race 2. I think that's a good sign. Yeah, I just put it by my...",48,en,False,False
clip_0984,I would get it. Still very good effort. Where did Franco finish? Franco finished.,14,en,False,False
clip_0985,Good the only way round. I'll just give you the quick running order Romano pickup and monitor drink as well So Anthony Lee one Russell Hamilton So behind,28,en,False,False
clip_0986,"You know at the start I had everything under control before the safety car, we had like a good gap Then after it was Flossed out with that, but anyway, it's been a very good weekend guys Thanks for the car That was very enjoyable",45,en,False,False
clip_0987,and see if we step forward so I'm glad we're able to be raised to with everything that's coming it's promising so yeah thanks for the weekend,27,en,False,False
clip_0988,"That's the same as the bigger one as well. More to come. So we are boxing now. It's a hot furmaid and they're not much. Okay, so when you come to a stop, you've got P1.",36,en,False,False
clip_0989,Thanks for watching guys!,4,en,False,False
clip_0990,"The clock just backs up Lewis in the race. I'm sorry, there wasn't a field. Come on, mate, we've reported him. I am supposed to be on your side, Max, trying to give you some help. The Chinese Grand Prix is underway!",42,en,False,False
clip_0991,"It's Hamilton, Antonelli, Leclerc and Russell the top four.",9,en,False,False
clip_0992,"That is bold stuff, not completed on the road, but real statement of intent for Oliver Bearman, who will surely have to give the place back to Isaac Hadjarni immediately. Have you okay with the car? Yes.",37,en,False,False
clip_0993,"But turns out destroy little books to my generations. Yeah, copy.",11,en,False,False
clip_0994,"have to move up to seventh. Oh, sorry, that's this. That's contact in turn three. I'm gonna just check on it.",21,en,False,False
clip_0995,"left rear. Copy that tires look okay, pressure is good. No major issues with the car at the moment, just north your tire, watch your front left.",27,en,False,False
clip_0996,"Yeah. 80 one if you can. Yeah. 25.5 ahead and behind George. 25 behind the clear. Kimmy Antonelli back to the lead. So look, look, we'll have overtake ahead.",29,en,False,False
clip_0997,"Russell trying to get the move done. Russell to the inside of turn number one. Dip entry, dip high speed available. Lewis point six behind. Good. So Lewis will have overtake. That is George Russell, disappeared.",36,en,False,False
clip_0998,"up to second place. Mercedes 1-2. Try to get through as efficiently as possible, Max, but without over-stressing them in the areas that we would want to avoid, please.",29,en,False,False
clip_0999,"Off the road goes Lance Troll, the Aston Martin coming to a halt in the first",16,en,False,False
clip_1000,"Turns on the racetrack. Safety car, safety car. Safety car window is closed. All in the top four. So they just had to. We've seen the medium tyres going away. It's lap 11, so...",34,en,False,False
clip_1001,"could well be a two stop. But I was with the safety code for this only thing you just watch the delta please make sure the delta just positive. Very frustrating. Right. Let's just focus on ourselves here, buddy. Antonelli back out in front. Colopinto Ocon.",46,en,False,False
clip_1002,"Hamilton then Arvid Lindblad listed as P6, Charles Leclerc in seventh. Man, the safety car is so slow. Yeah, copy. Well, see what we can do. Look at Ollie, the safety car in this lap. It's in a very good position, Ollie. Copy.",43,en,False,False
clip_1003,I'm going to let him... I'm going to let him live.,11,en,False,False
clip_1004,Thank you for watching!,4,en,False,False
clip_1005,"and focus on turn seven and eight, they will help later on. Overtake enabled, if you're clerked behind, we'll have overtake.",21,en,False,False
clip_1006,George Russell passed by both Ferraris at the start of the hard tyre stint. We're gonna f***ing grab us. Hamilton knows how to win around here. Can he now take the lead like he did yesterday? That's the aim. Well done.,41,en,False,False
clip_1007,and now focus on tires.,5,en,False,False
clip_1008,Good job. More saving. Turn seven. Russell finally makes headway. Surprises Ocon with a move down the inside at turn six. George Russell looking for the move to the inside. Oliver Bearman claiming seventh.,34,en,False,False
clip_1009,into the braking zone.,4,en,False,False
clip_1010,the cars ahead still have to stop call it an Estaban.,11,en,False,False
clip_1011,"Colopinto, Ocaron, Bearman and Gasly is how they begin things. That's not how they're going to end things when it comes down to the end of this super long back straight.",31,en,False,False
clip_1012,"Keep position, keep position.",4,en,False,False
clip_1013,"Yeah, that wasn't fair. One meal of the roof. I'm sorry, that wasn't fair. Copy that mate, we've reported him. Now mate, let's focus. You've got this.",27,en,False,False
clip_1014,and,1,en,False,True
clip_1015,"What are we fighting on this? On to game. No dude, what the f***? Okay, I don't know.",18,en,False,False
clip_1016,"worry or come back. It's honest. I have no words. Okay, so that happened because you lifted and then went back on power for 10 14. So we need to avoid that to stop spending energy. You know, I'm fighting. No, you're fighting. Yes, mate. You just got to keep this consistent as you can. The three cars in front of all got to box anyway.",66,en,False,False
clip_1017,"Well, that's late on the brakes in second position for Charles Leclerc, who gets past Lewis Hamilton. What the fuck's he doing? Lewis will have overtake. The front just backs up Lewis.",32,en,False,False
clip_1018,"this. I'm right. Hamilton trying to come back very brave. How's the grip out there? Oh, it's close between the Ferrari's for the second day in a row and Charlotte Clare hangs onto it. Yeah, but 3.8 Ferrari's a bachelor. Hamilton's",41,en,False,False
