clip_id,text,word_count,language,is_empty,is_very_short
clip_0510,"Yep, I hear you. We're still just on the low side of temp, so we'll try and do a better job on the out lap and we'll take some balance off. We'll calm it down. Okay, so we'll box into this lap. You can push on this in lap. In sync with Fernando behind. Okay, so, loss in and behind, pushing. We'll be boxing.",64,en,False,False
clip_0511,"Lensing end of this lap. I'll send nine behind. Box now, Lance, box now. I'll send four behind, pushing, finishing again. Box now. Waybridge, Lance, Waybridge. You can go back to P2 when you're ready.",35,en,False,False
clip_0512,"The lamps will just push as hard as we can on the outlap. We'll do weaving everywhere. I don't even know what the flap is. What's that huge under and over? I know, I know. I can see everything. I know. We're going to take off a chunk of our balance. That'll just get it a little more calm, and we'll get the tires warmed up, and it'll be OK. So we're just going to push on this outlap. You'll weave everywhere.",82,en,False,False
clip_0513,the the the the,4,en,False,False
clip_0514,"now on the push. Okay, so next pushing is a big gap, so a big gap behind. So you've got Lin Blatt ahead, you're in sync with him. No one pushing behind. So it's pushing",35,en,False,False
clip_0515,"We'll have SLM off and weaving, SLM off and weaving. To maximize the energy into the tires, SLM off and strong weaving. Same again here. Lots of strong weaving, SLM off, strong weaving. Keep working that weaving, that's good. Keep doing the weaving, no one pushing behind. We'll make a gap later in the lap.",55,en,False,False
clip_0516,definitely on the lifting coast we need 30 meters more both places so a much more lifting coast because we're missing energy so get that harvesting done with big lifting coasts 6 and 11 let's try and get those last couple gear sinks okay so Lynn black gas least still to go,52,en,False,False
clip_0517,"Remember go one, go one. Remember go one, make a little gap to Linblat. Cap is three, four, five. Remember charge off, charge off. 100 meters lift here, 100 meters lifting coast, big one. Trust me this one.",38,en,False,False
clip_0518,"So this is shit. I'm sure I've been in my fucking life. Box now, Lance, box now. Pull around, pull around.",21,en,False,False
clip_0519,Thanks for watching guys!,4,en,False,False
clip_0520,"and Bottas is the lead guy, he's just approaching the final corner let's assume that we're close to a car exit and I'll update you the science is the science of approaching the safety car line, so let's turn 1 now and then we've got a gap the next car is going to be",54,en,False,False
clip_0521,"Linnblad B is turn 2 About eight cars ahead of us to go Linnblad failed, so it's Stroll in turn 10 If you include the Williams ahead, then there's five cars to go Yeah, the mirror is not working at all, so...",42,en,False,False
clip_0522,"the roof top of it. Yeah, understood. There's still two cars ahead to go, Stroll's just had a 13. One car ahead to go, which is signed for when you can see. Stroll is approaching turn 14 now, and Lado happy to complete.",43,en,False,False
clip_0523,"lap. We'll box this lap, keep the revs left on the inlap. Car behind is Oscar, he's on his inlap as well. Behind him is Colopinto on an outlap. There's kind of time that probably para's in turn 1. We've still got Oscar just leaving 6.",46,en,False,False
clip_0524,"Pinto outlap the 6 Perez time lap turns 6. Perez turn 8. Perez turn 11. Perez just leaving 13. And we're boxing this lap, stopping in front of our garage. Chocola Pinto is just a...",35,en,False,False
clip_0525,"he should be ahead. Perez is pitted so I think he'll be clear at exit. Clear at exit. Limblad is overstepping, it should have just done a time that could be slow. Keep an eye on him, he's in turn one.",41,en,False,False
clip_0526,Happy with your toggle use. You could add the left hand shoulder to the paddle use. So first car time-lapse is Albon just leaving turn 3. In front of you you should have good gas. Albon is approaching,38,en,False,False
clip_0527,turn six now. Albon's leaving six behind him as LeFleur on an out lap or through the six.,18,en,False,False
clip_0528,"Polepinto the car ahead of you is on a cool down lap. I'll try and look out what he's doing. Albon is 10-8. That's Albon turn 9. Albon turn 11. Not clear what Polepinto will do. Albon is in turn 13. After him, car time.",45,en,False,False
clip_0529,"and up is Hamilton turn 11. Car behind you though is Leclerc on and out that, Hamilton's three back and turns 12 on a time lap. Think it will be clear ahead when you get there. Hamilton's approaching turn 14. Assumed for now, single cool, hit the reds up.",49,en,False,False
clip_0530,"In all the virtual dash, he's ignored the virtual mirror, it's completely wrong. And Lando, we're having to box this lap, we're having to box. The clerk is behind you, he should be slow. There's still no one behind to worry about. The clerk's on a slow lap about 8 seconds back.",52,en,False,False
clip_0531,"Thank you, we are boxed as well. Pilt, you should be...",11,en,False,False
clip_0532,"5, 6, 5, 4, 3, 2, 1",7,en,False,False
clip_0533,Please cars still to go ahead all well space two cars to go and limb level open right behind you boxes that keep the revs up after him as Oscar should be slow and everyone behind is in place,39,en,False,False
clip_0534,I'm about to grab some of the Markers. I can lock out more...,13,en,False,False
clip_0535,It will be clear exit. There's no one behind you. And yet clear exit. And landed mine. White H9 position 12. White H9 position 12. Two cars ahead to go. Well spoken. Let's assume,34,en,False,False
clip_0536,"single pull, Antonelli's out of the final corner, he revs up, he will open the lap. That's Antonelli in turn 1, Antonelli turn 3, then there's about 8 seconds to rustle. Antonelli right behind, main opportunities.",36,en,False,False
clip_0537,Speed through turn 1 Russell just left turn 4. Next opportunity is break point In turn 6 a little bit later Russell's bailed The next car time left is a Jart 25 Good job in the hairpin,37,en,False,False
clip_0538,"Keep it up, the JARs turn seven, we are going to open the lap. There are quite a few slow cars between you and sort of half opening 13 and 14, so we might get packed up a bit. The JARs just in 10, JARs in 10, 11, there's five cars still to go. About five seconds behind.",58,en,False,False
clip_0539,"The car who's in 13 is Bistappen. The car will come up quick. Then 5 seconds to Bistappen. There's only one car ahead to go now. Bistappen is approaching 14. And we'll box this up, keep the revs up.",39,en,False,False
clip_0540,"behind Box is up stop in front of our garage Okay, mate you're all plugged in",16,en,False,False
clip_0541,Antony Lee is approaching the final corner now.,8,en,False,False
clip_0542,"And clearly he's just passed that finish line, he's safe to go so he'll be ahead.",16,en,False,False
clip_0543,"5, 4, 3, 2, 1, and then the clerk's over the staff finish line.",14,en,False,False
clip_0544,"Leclerc's turn two and three Ah, the Leclerc is Hamilton's turn one Russell's been slowly currently at a turn ten Leclerc's the place behind you Hamilton just left turn four Well behind you is Oscar on his outlet Hamilton's turn",40,en,False,False
clip_0545,6th Hamilton in 7th Hamilton in 9th Russell is slow out of 13th Hamilton in turn 11th There's one car ahead to go Russell slow ahead of you Hamilton just leaving 13th,32,en,False,False
clip_0546,"The car ahead, Gathley's just slowed up to let the clerk through, he's in turn 14. Hamilton will catch up a few quickly. The next car is Bairman, turn 13. Clear ahead. This lap, keep the revs up, should be in the phase with cars behind.",46,en,False,False
clip_0547,and what's the fact that our garage out loud please,10,en,False,False
clip_0548,is SLM off into turn 14 and more weaving ok if we're going to box this lap Russell might try and open he's coming out of the final corner now that's Russell in turn 1 Russell's in turn 3 Russell's approaching 6,42,en,False,False
clip_0549,"It's a muscle in 7, muscle in 9, and no one else to talk about. And confirming we boxed the fact. 136.",22,en,False,False
clip_0550,,0,en,True,True
clip_0551,"4, 5, 6, 7 and green 6, position 2, green 6, position 2 BOTAS 5 BOTAS 3, wind similar to this morning NASCAR pushing, cola pinto",26,en,False,False
clip_0552,7 and box box cabin 3p6 charlie is p3 is half a second in front of us and charlie is on soft he is locking a lot he's braking copy continue and 16 were good,35,en,False,False
clip_0553,And feedback for flaps for new software Car feels on this tire with a little bit of mystery It feels good the car just has snapped 60 on the braking Copy I would go for the standard compensation,38,en,False,False
clip_0554,"So, and box box, we please stop for a short. The trousers get in front of the left. To the right. To the right. Okay, to the left. Wave edge, wave edge. And focus on the out-trop. Limb-lad on the mainste.",41,en,False,False
clip_0555,"Antonelli 3, Antonelli 3, I recommend 60 bmg3, Antonelli 2, CW5, CW2, NW5, NW5, NW5, NW5, NW5, NW5, NW5, NW5, NW5, NW5, NW5, NW5, NW5, NW5, NW5, NW5, NW5, NW5, NW5, NW5, NW5, NW5, NW5, NW5, NW5, NW5, NW5, NW5, NW5, NW5, NW5, NW5, NW5, NW5, NW5, NW5, NW5, NW5, NW5, NW5, NW5, NW5, NW5, NW5, NW5, NW5, NW5, NW5,",60,en,False,False
clip_0556,"The escal behind is R6 P3, sharp push behind, sharp push behind Two tenths from R1, one tenth first sector, one tenth last sector And we think we are ok on our side",33,en,False,False
clip_0557,"That's a box. If you are happy, yes. We can use this set for YouTube. Piazza 5. Piazza 2. 4. 5. 6. 7. 8.",24,en,False,False
clip_0558,"target at a time 33 to Cousin for to view our old on scope so to Mercedes and us Delta speed the car has no working Understood, yeah confirm Gap to Charlize 4",33,en,False,False
clip_0559,in front behind is 15 seconds 7 seconds in front of us behind 10 now we are at 3.2 3.10 behind us 1.10 in the first sector,27,en,False,False
clip_0560,"Second sector, you were 1-10 faster. And 2-10 faster, second. Both are lit to 5 behind. That's going to last corner. Yes, we saw. Both are lit to 3.",29,en,False,False
clip_0561,"And one was one-tenth the final corner with the spectre shot. On set 12. Avoid the short ship in 12. And we are boxing for a new set also. One, two, three, four.",33,en,False,False
clip_0562,"5, 6, 7, 8 Norris 10 behind, on an outlapped, shall in front, 7 seconds Same wind, same path 10 We are P3, shall P1, 110, faster",27,en,False,False
clip_0563,"than you. Wilkenberg 5 behind Pusci, 1-10 first sector, 1-10 second sector, last sector you were fast. Wilkenberg 3, Antoni 6, time wise we are safe, happy to do another push.",31,en,False,False
clip_0564,"You want to do another push? Yes we will Antonio, you need to go shit You tell me We don't need this set It's up to you, I will do that up Yeah, just have it fall down with tires It's your focus Avoid short",45,en,False,False
clip_0565,"shift in 3 and lower gear in 6 and cool the car in p10 please cool the car 4 5 6 7 8 10 temperature over 5, temperature over 5. I have to do a little bit of photo view",40,en,False,False
clip_0566,"Double yellow, double yellow. I've moved the tire so... I will let you know. He's still stuck on the track. Keep them touching the tire. He's moving. I will let you know.",32,en,False,False
clip_0567,"Turkey is clear, Turkey is clear. Warm up your tires. And noise will push behind. Noise behind you will push. And box box, lap was good, about XC910. You lost 4 times there. We are P3 Antoneli P1.",38,en,False,False
clip_0568,6th 10th from Antonelli and 3 10th and a half from Charles just a 2 takes us alpha 10th 1st sector with Antonelli,23,en,False,False
clip_0569,"Alpha second, Alpha second, second sector. And one tenth last step. And was in turn 16. One, two, three, four, five, six, seven, eight.",24,en,False,False
clip_0570,"currently picture, Antonelli first return from you and more slow please, more slow and SM on if you can Charlie's third, 10ms slower than you see ya street",28,en,False,False
clip_0571,"No, it's 5, 3D110. P3. Now Russell is pushing. At the moment we are P2. And we are P3. Russell P2, Antonelli P1, is 210s, 110s.",26,en,False,False
clip_0572,"from your last, so we are three three seven two tenths in first sector, two Antonelli, same second sector and one tenth in the last sector, put the pit lane three three well done. Good job guys.",37,en,False,False
clip_0573,Thanks for watching guys!,4,en,False,False
clip_0574,"And I remind you that we'll see you by point. Let's go down one click if you can. One down, need one down. I remind you. Okay. I'm in the red a bit. Is it okay?",36,en,False,False
clip_0575,copy and avoid full throttle please avoid full throttle and 4 long burnout and one short please 4 long burnout one short and more the K2 and boost reminder and last car is on the grid now,37,en,False,False
clip_0576,"overtake is enabled Antonelli has overtake behind you you have the overtake, you have the overtake as a overtake behind you you have the overtake and reminder SM in",29,en,False,False
clip_0577,"the backstreet as Sam in the backstreet. And we need more tires saving in 7, please, more tires saving in 7. Tire updated when you can. Sam, are you okay? He just... Oh, battery. Early braking, early turning.",38,en,False,False
clip_0578,"in turn 16. Oh I got overtake. Yes, you have switch position yellow. Ah, to keep up with his dice. Fine, we understood. Keep focus on dice please. I have no power.",32,en,False,False
clip_0579,I lost the start line. Understood. No overtake. Let's push in 7. You can behind the no-vertation. And no push-button exit 15 is detrimental for power. Okay.,27,en,False,False
clip_0580,"Turn 7 was good, keep it as reference, shall let's overtake behind you. Ready, pressing. Let's start. A bit more saving, in turn 8, turn 7 was fine. And switch position already.",32,en,False,False
clip_0581,"What? Switch position red earlier braking, turn 14, let's speak They're just rolling away ahead Copy Entry 5, mid 2, suggestion Entry 5, mid 2 We are on plan A We are on plan A, shall overtake Biaunin",38,en,False,False
clip_0582,"you. Flap at 80 when you can. I mean, what else is there to be dropping? Safety car, safety car. Box, box. Yeah, going for plus two. Understood.",28,en,False,False
clip_0583,"K2, K2, a fresh gear! mode safety car, mode SC and reset the diff I was face talking was fine, was fine, just my status faster",26,en,False,False
clip_0584,and good job on tires and stay to spring to start with these tires you are on hard and if I still need to save at 7 still need to save and the level would be stay to spring so you want me to lift through there right,48,en,False,False
clip_0585,lift I was doing yeah it was alright there would be a recovery vehicle in turn 2 and it's double yellow there in turn 2. Give me any updates you can just on the driving. I will. Was any other cars having grainy?,43,en,False,False
clip_0586,"Gasly behind at the greeny, where Schall was driving and the last laps were very good as a reference for time management 178 were good for us Since my tires are really cold God, this is a bit out of place",41,en,False,False
clip_0587,"to slow for a... and that's it, we will report and think about rearward deep brake balance for turn one if you can safety care in this lap only place to improve driving wise is braking 14, less peak",39,en,False,False
clip_0588,"they are braking. And green one position it. Reminder for the restart. So K2 before 14, low gears, IRFs. I got K2.",22,en,False,False
clip_0589,"A4, K2, K2. Overtake, we have overtake. Slide down and now focus on tires. And you have overtake and mode FW and boost on the main state. We are on plan.",31,en,False,False
clip_0590,"A, think about your task. You have overtake. Don't have battery. Depth you on the back straight, stay on the left, stay on the left. It will power me. We are on it. Use boost on the main straight. Don't have.",41,en,False,False
clip_0591,"No overtake and motor is, think about your tires, watch 427. How's my behind? Shall I do one second and a half behind? Same pace. Green one, position one when you...",31,en,False,False
clip_0592,"green one position one a bit more saving in seven if you can a bit more saving in seven That's behind Shot 1.3 1.3 shot. Peace, oh cat. Peace. Right now",31,en,False,False
clip_0593,"Why? Get up behind. Okay, where?",6,en,False,False
clip_0594,"move Apert speed 16, early entry suggested, Char 1.5 Don't lose the time to cover high You are just losing out of 16 and we recommend",26,en,False,False
clip_0595,"and a light toggle for 16, a light toggle Let me know if the gear I'm using is wrong Copy 16 was good and gears are good My dash, the cap I'm showing is the HR force Let me know",40,en,False,False
clip_0596,I'm losing. I'm behind overtake. You are at the last at the wind overtake. I'm shitting slow. We're not losing that one. Coming back to you. R6 turn.,28,en,False,False
clip_0597,Hey My apex still down Let's see Turn 16 Apex speed turn 3 Apex speed turn 16 You have overtake? You have overtake?,23,en,False,False
clip_0598,early entry turn 7 for tyres and watch for front locking interface and you have overtake I'm just down on power on the top I'm just a little bit understeer I'm just a little bit understeer think about your tyres,40,en,False,False
clip_0599,"Do you have a VWT? Overtake available, Charles as well. Only place to improve, N31. But think about your size there. How much do I need to improve there? One tenth and a half. And the earlier full throttle out of 12.",42,en,False,False
clip_0600,"Overthake available. Ape is 16, suggestion higher gear there, try higher gear. Ape is 50. 25 laps to go. You have overtake, char, down. When I get on the pit straight, I've got no power.",35,en,False,False
clip_0601,I got the second happens. Yeah. I got the second happens. And I face up. Get where you can. Switch position yellow. Switch position yellow. Double yellow. Turn two three. Double yellow. This is slippery. Slippery.,36,en,False,False
clip_0602,"Let's see a double yellow. Overtake available, watch debris. And earlier full throttle out of 12. Stay with him if you can. If you're doing well. Overtake available. I have no power. Fear keeping something.",35,en,False,False
clip_0603,Don't be usable I come out of the last corner with no power negative we are looking into that So I don't Have to chew and three people For power. This is the most efficient we can ever the minute This is good keep it up,46,en,False,False
clip_0604,I love understeer. I'm just doing it. Inshallah there's no vertical. No collapse. 15 laps to go when you cross the line. No overtake for shark. No overtake for shark. Keep it up.,33,en,False,False
clip_0605,Keep the gap if you can 1.3 you are doing very good job And we are quick and then Charles everywhere You are opening the gap good job We have three lap car ahead good job on Charles,38,en,False,False
clip_0606,"Charles is to behind Mercedes 14 in front 410 faster than Charles, gap, lap car in front of you, solid blue Up it up 11 laps when you cross the line, 11 laps",33,en,False,False
clip_0607,"Switch position, yes. You are doing a good job on tyres, good job on tyres. Charles, right behind. 8 speed 16, 1 temp, 8 speed 16. Charles, 2.8, think about your tyres, good job. Solid blue for botters.",38,en,False,False
clip_0608,Can't left to go. Face. Perfect. Face is good. Watch for front lock in 6. Air brake in lower peak in 6. Gap 2.0.,24,en,False,False
clip_0609,"Charles is 3 seconds, you are doing a good job. Charles 2.5 The time is... Apex 16 Gap behind, 3 seconds At 6.16 to improve, think about the right toggle there.",31,en,False,False
clip_0610,"Time! Gap behind, 3.2, 3.2 you are doing well, exit 16 to improve. Early entry 16, 2.8 behind. Rest is fine. Early braking in 6, suggest. In 3 seconds, take up behind.",32,en,False,False
clip_0611,"3 seconds 6 times to go when you cross the line 210 faster than Charles, 4x4, apex 16, the rest is good Got behind 3.3 And watch for braking 1014, Charles behind you is locking a lot",37,en,False,False
clip_0612,"3.7 and 4 laps to go when you cross the line 3.8 the gap behind take care about your tires this gap behind is 4 seconds, 4 seconds, easy on braking in turn 6",34,en,False,False
clip_0613,and 14 cars around you are locking everywhere keep an eye on that please and char 3.6 repeat char 3.6 3.6 gap behind good luck to go 3.8,28,en,False,False
clip_0614,"Gap behind, 3.8 Gap behind is 3.7, 3.7 And last lap, last lap 3.5 behind And well done Luis, sorry the race, cleared as much as we wanted, thank you",30,en,False,False
clip_0615,And most of all please fantastic job fantastic job guys really well done Really cool for the hard work. We're gonna keep up keep pushing Back at my Ronello. We got work to do but I believe in you. Let's keep pushing. What's the Ferrari? Okay,46,en,False,False
clip_0616,"Thank you! Congrats Kimmy! And we go through the pit lane, we stop in front of the pit lane, negative on the grid, on the grid in front of the pit lane position. We stay on the grid. Ignition off, MP0 please.",42,en,False,False
clip_0617,Thanks for watching guys!,4,en,False,False
clip_0618,We join the queue and switch off.,7,en,False,False
clip_0619,We are three minutes to green.,6,en,False,False
clip_0620,"Yeah, one minute to green, I will let you know for a minute.",13,en,False,False
clip_0621,"Okay, engine start. 25 seconds to green. We have green light. Remind the maximum 8 seconds to the client from. Obviously, a hard out club would be good. Yes, probably. That's clear.",32,en,False,False
clip_0622,go charge off multi be one position ten charge on IRPM reminder no one pushing behind this is in lap okay I don't know if it's balance or what but I've run so,33,en,False,False
clip_0623,"which is first time on weekend, I don't know why cause copy wool check temperatures keep it based up in the inlet first car pushing behind bottle and nine seconds bottle level seven behind bottle level now 4.5",38,en,False,False
clip_0624,Let's go 3.5 box box Let the two box box watch the bridge I've no virtual barista you are it was important. Yeah the same for other people about it. I'm happy to,33,en,False,False
clip_0625,"Happy to go one step more rotation with the flap? Yeah, one step more. Okay, Liam, next flap we try to not wait on throttle exit of last corner on the outer scope. We have Alonso on the main straight, now okay he's in front, you are here behind. You can go Char-Doc.",53,en,False,False
clip_0626,"get some weaving in the back straight, position is very good. Again, push last corner and you can go throttle as soon as you can, no need to wait. Carjohn and IRPM reminder, no one pushing behind. This is currently P6 Liam.",42,en,False,False
clip_0627,I will go for double cooldown game. Keep the weaving in the two cooldowns for the front tires. First car pushing is Ocon 9 behind. Arvid wider apex turn 2 is finding some lap time in 123.,37,en,False,False
clip_0628,"Ocon 7 behind, Ocon 5, Ocon 3, Berman 9, Ocon behind you now, Berman is 5. Some full throttle way you can, you should be in place with Berman behind you now.",32,en,False,False
clip_0629,You have a hajar on out lap behind no one pushing behind for now. What's the limitation turn 11? The difference between the driver and the car. From a charge off? If you can keep the position it's better to be set behind your hajar is out lap.,48,en,False,False
clip_0630,"No one interrupts, we are good. Car is not charged. Charge on IRPM reminder, go and push from behind. Box, box. Box, box. That was 216. We think single push, you agree?",32,en,False,False
clip_0631,"Yeah, same approach, I struggled on the last stop, I'm a star. So, against Harvard, Indian, the two places are 123 and 6, so I think things were faster than before.",31,en,False,False
clip_0632,"I can zoom into those corners. So yeah, see the light before you apply it, let's do it better.",19,en,False,False
clip_0633,"The bearman is opening a lap on the line now. Three behind, two behind now. The truck is clear behind, you know. You can go easy on power. And turn it very slow around you there. You can go charge off.",41,en,False,False
clip_0634,"of you Russell, four seconds we don't slow down, no weaving in the back straight, multi-beat one position ten, position is very good, we think Russell in front will not be pushing next up, and full pass corner.",38,en,False,False
clip_0635,"IRPM reminder Dear behind Mate, front one is fucking terrifying. They're not ready. Copy that, we are reviewing. Middle part of the lap is definitely better, but 14 is a lot, every lap is different. I love this one.",39,en,False,False
clip_0636,"I'm not sure what's wrong. A box box. An advice is to keep second gear longer in turn 12. Box box. Jumping. Yeah, I had a massive, massive snap this week.",31,en,False,False
clip_0637,Yes. Happy to keep the flap.,6,en,False,False
clip_0638,"I can't be very sorry for Peter. Happy to see you, sir.",12,en,False,False
clip_0639,"Okay, so all the systems want to trace you, the only place we are losing to Arvid, so he's breaking",20,en,False,False
clip_0640,"low, not as hard as you are doing, so he's pitching less the car and he's rolling more the car later in the corner with a wider line in put on 2.",32,en,False,False
clip_0641,"bit coping is, driving is going forward offset if you want, offset 0 and then we go offset minus 1 after 10.4.",22,en,False,False
clip_0642,Happy to get what sir? We can go to zero now and then like that we don't just sink into the after a platform.,24,en,False,False
